{
  "meta": {
    "generated_at": "2026-01-01T00:00:00Z"
  },
  "resource_counts": {
    "Location": 6,
    "Group": 2,
    "Observation": 48,
    "Provenance": 36
  },
  "bundles": [
    {
      "name": "terminology",
      "path": "fhir/out/terminology.json",
      "resource_type": "Bundle",
      "count": 4
    },
    {
      "name": "locations",
      "path": "fhir/out/locations.json",
      "resource_type": "Bundle",
      "count": 6
    },
    {
      "name": "consumption",
      "path": "fhir/out/consumption.json",
      "resource_type": "Bundle",
      "count": 12
    },
    {
      "name": "predictions-TLS",
      "path": "fhir/out/predictions-TLS.json",
      "resource_type": "Bundle",
      "count": 18
    },
    {
      "name": "predictions-GNT",
      "path": "fhir/out/predictions-GNT.json",
      "resource_type": "Bundle",
      "count": 18
    },
    {
      "name": "reference-measurements",
      "path": "fhir/out/reference-measurements.json",
      "resource_type": "Bundle",
      "count": 6
    }
  ],
  "validation": {
    "status": "unknown",
    "errors": 0,
    "warnings": 0,
    "validator_version": null,
    "ran_at": null,
    "ci_log_url": null
  },
  "query_demo": {
    "laboratory": {
      "query": "Observation?category=laboratory",
      "count": 6
    },
    "model_prediction": {
      "query": "Observation?category=https://pharmashed.example/fhir/CodeSystem/observation-category|model-prediction",
      "count": 36
    }
  }
}
